{
  "$schema": "https://json-schema.org/draft/2020-12/schema", "$id": "https://mission-control.local/data/schema/metrics.schema.json", "title": "Mission Control metrics projection v1",
  "type": "object", "additionalProperties": false, "required": ["schemaVersion", "domain", "generatedAt", "ok", "reason", "sources", "data"],
  "properties": { "schemaVersion": { "const": 1 }, "domain": { "const": "metrics" }, "generatedAt": { "type": "string", "format": "date-time" }, "ok": { "type": "boolean" }, "reason": { "type": ["string", "null"], "minLength": 1, "maxLength": 160 }, "sources": { "type": "array", "maxItems": 12, "items": { "$ref": "#/$defs/source" } }, "data": { "anyOf": [{ "$ref": "#/$defs/data" }, { "type": "null" }] } },
  "allOf": [{ "if": { "properties": { "ok": { "const": true } } }, "then": { "properties": { "reason": { "type": "null" }, "data": { "$ref": "#/$defs/data" } } }, "else": { "properties": { "reason": { "type": "string", "minLength": 1 }, "data": { "type": "null" } } } }],
  "$defs": {
    "source": { "type": "object", "additionalProperties": false, "required": ["id", "kind", "path", "ok", "observedAt", "reason"], "properties": { "id": { "type": "string", "pattern": "^[a-z][a-z0-9._-]{0,79}$" }, "kind": { "type": "string", "pattern": "^[a-z][a-z0-9._-]{0,79}$" }, "path": { "type": "string", "minLength": 1, "maxLength": 240 }, "ok": { "type": "boolean" }, "observedAt": { "type": ["string", "null"], "format": "date-time" }, "reason": { "type": ["string", "null"], "minLength": 1, "maxLength": 160 } }, "allOf": [{ "if": { "properties": { "ok": { "const": true } } }, "then": { "properties": { "reason": { "type": "null" } } }, "else": { "properties": { "reason": { "type": "string", "minLength": 1 } } } }] },
    "metricMap": { "type": "object", "additionalProperties": { "type": "integer", "minimum": 0 }, "maxProperties": 64 },
    "metricObservation": { "type": "object", "additionalProperties": false, "required": ["ok", "reason", "observedAt", "value"], "properties": { "ok": { "type": "boolean" }, "reason": { "type": ["string", "null"], "minLength": 1, "maxLength": 160 }, "observedAt": { "type": ["string", "null"], "format": "date-time" }, "value": { "anyOf": [{ "$ref": "#/$defs/metricMap" }, { "type": "null" }] } }, "allOf": [{ "if": { "properties": { "ok": { "const": true } } }, "then": { "properties": { "reason": { "type": "null" }, "value": { "$ref": "#/$defs/metricMap" } } }, "else": { "properties": { "reason": { "type": "string", "minLength": 1 }, "value": { "type": "null" } } } }] },
    "data": { "type": "object", "additionalProperties": false, "required": ["sessions", "fleetSupervisor", "services", "requests", "queue", "audit", "memory"], "properties": { "sessions": { "$ref": "#/$defs/metricObservation" }, "fleetSupervisor": { "$ref": "#/$defs/metricObservation" }, "services": { "$ref": "#/$defs/metricObservation" }, "requests": { "$ref": "#/$defs/metricObservation" }, "queue": { "$ref": "#/$defs/metricObservation" }, "audit": { "$ref": "#/$defs/metricObservation" }, "memory": { "$ref": "#/$defs/metricObservation" } } }
  }
}
