{
  "schemaVersion": 1,
  "domain": "metrics",
  "generatedAt": "2026-08-06T08:36:08.796Z",
  "ok": true,
  "reason": null,
  "sources": [
    {
      "id": "live-preflight",
      "kind": "cli",
      "path": "tools/agent-preflight.js",
      "ok": true,
      "observedAt": "2026-08-06T08:36:08.858Z",
      "reason": null
    },
    {
      "id": "canonical-ledger",
      "kind": "reader",
      "path": "tools/ledger-query.js",
      "ok": true,
      "observedAt": "2026-08-06T08:32:25.510Z",
      "reason": null
    },
    {
      "id": "canonical-queue",
      "kind": "reader",
      "path": "BUILD-QUEUE.md",
      "ok": true,
      "observedAt": "2026-08-06T08:22:18.148Z",
      "reason": null
    },
    {
      "id": "audit-sqlite",
      "kind": "sqlite",
      "path": "state/audit.sqlite3",
      "ok": false,
      "observedAt": null,
      "reason": "source-unreadable-safely"
    },
    {
      "id": "memory-sqlite",
      "kind": "sqlite",
      "path": "state/toolsenabled.sqlite3",
      "ok": false,
      "observedAt": null,
      "reason": "source-unreadable-safely"
    }
  ],
  "data": {
    "sessions": {
      "ok": true,
      "reason": null,
      "observedAt": "2026-08-06T08:36:08.858Z",
      "value": {
        "codex": 8,
        "claude": 6
      }
    },
    "fleetSupervisor": {
      "ok": false,
      "reason": "source-unavailable",
      "observedAt": "2026-08-06T08:36:08.858Z",
      "value": null
    },
    "services": {
      "ok": true,
      "reason": null,
      "observedAt": "2026-08-06T08:36:08.858Z",
      "value": {
        "total": 5,
        "stale": 1
      }
    },
    "requests": {
      "ok": true,
      "reason": null,
      "observedAt": "2026-08-06T08:32:25.510Z",
      "value": {
        "total": 452,
        "open": 402
      }
    },
    "queue": {
      "ok": true,
      "reason": null,
      "observedAt": "2026-08-06T08:22:18.148Z",
      "value": {
        "total": 68,
        "blocked": 22,
        "done": 21,
        "open": 15,
        "in_progress": 10
      }
    },
    "audit": {
      "ok": false,
      "reason": "source-unreadable-safely",
      "observedAt": null,
      "value": null
    },
    "memory": {
      "ok": false,
      "reason": "source-unreadable-safely",
      "observedAt": null,
      "value": null
    }
  }
}
